{
  "schemaVersion": "1.0.0",
  "capabilitiesVersion": "1.0.0",
  "role": "moderator",
  "displayName": "Moderator Worker",
  "summary": "Relays generated traffic while annotating messages with provenance headers.",
  "config": [
    {
      "name": "enabled",
      "label": "Enabled",
      "description": "Pause moderation without stopping the service.",
      "type": "boolean"
    }
  ],
  "actions": [],
  "panels": []
}
