{
  "schemaVersion": "1.0.0",
  "capabilitiesVersion": "1.0.0",
  "role": "processor",
  "displayName": "Processor Worker",
  "summary": "Invokes downstream HTTP services for each moderated message and emits enriched results.",
  "config": [
    {
      "name": "enabled",
      "label": "Enabled",
      "description": "Disable processing temporarily while leaving queues intact.",
      "type": "boolean"
    },
    {
      "name": "baseUrl",
      "label": "Target base URL",
      "description": "HTTP endpoint invoked for each work message.",
      "type": "string",
      "validation": {
        "format": "uri"
      },
      "ui": {
        "placeholder": "http://processor.local",
        "order": 10
      }
    }
  ],
  "actions": [],
  "panels": []
}
